{
  "document_id": "legacy/scenario/7ba5d82bdc2a/ch17",
  "events": [
    {
      "actions": [
        {
          "action_id": "legacy/action/7ba5d82bdc2a/events/0/0",
          "extensions": {},
          "type": "spawn_party"
        }
      ],
      "event_id": "legacy/event/7ba5d82bdc2a/events/0",
      "extensions": {
        "legacy": {
          "id": "opening",
          "once": true
        }
      },
      "trigger": "on_battle_start"
    },
    {
      "actions": [
        {
          "action_id": "legacy/action/7ba5d82bdc2a/events/1/0",
          "extensions": {
            "legacy": {
              "camp": "ally",
              "groups": [
                2
              ],
              "native_event_id": 40,
              "native_spawns": [
                {
                  "group": 2,
                  "raw_placement_gate": 0,
                  "source": "0x34fd7",
                  "via": "spawn_group"
                }
              ]
            }
          },
          "type": "spawn_group"
        },
        {
          "action_id": "legacy/action/7ba5d82bdc2a/events/1/1",
          "extensions": {
            "legacy": {
              "camp": "ally",
              "grid": [
                17,
                37
              ],
              "native_event_id": 40,
              "native_source": "0x34fdf"
            }
          },
          "type": "pan"
        },
        {
          "action_id": "legacy/action/7ba5d82bdc2a/events/1/2",
          "extensions": {
            "legacy": {
              "camp": "ally",
              "native_dialogue_ref": {
                "control": "FFEF",
                "line": 5,
                "operand": 68,
                "pages": [
                  [
                    "『密蒂閣下，我們沒有來遲吧",
                    "　！』"
                  ]
                ],
                "scene_index": 1,
                "script": "assets/story/ch17.json",
                "source_dat": "FDTXT_017",
                "string_index": 1,
                "utterance": 0
              },
              "native_event_id": 40,
              "native_source": "0x34bf6",
              "native_text_index": 1
            }
          },
          "type": "dialogue"
        },
        {
          "action_id": "legacy/action/7ba5d82bdc2a/events/1/3",
          "extensions": {
            "legacy": {
              "camp": "ally",
              "native_dialogue_ref": {
                "control": "FFEE",
                "line": 6,
                "operand": 18,
                "pages": [
                  [
                    "『各位來的正好！敵人兵力強",
                    "　大，請各位盡力作戰，我們",
                    "　務必取得勝利！』"
                  ]
                ],
                "scene_index": 1,
                "script": "assets/story/ch17.json",
                "source_dat": "FDTXT_017",
                "string_index": 1,
                "utterance": 1
              },
              "native_event_id": 40,
              "native_source": "0x34bf6",
              "native_text_index": 1
            }
          },
          "type": "dialogue"
        },
        {
          "action_id": "legacy/action/7ba5d82bdc2a/events/1/4",
          "extensions": {
            "legacy": {
              "camp": "ally",
              "native_dialogue_ref": {
                "control": "FFEF",
                "line": 7,
                "operand": 68,
                "pages": [
                  [
                    "『是！我們一定不會讓閣下您",
                    "　失望的！』"
                  ]
                ],
                "scene_index": 1,
                "script": "assets/story/ch17.json",
                "source_dat": "FDTXT_017",
                "string_index": 1,
                "utterance": 2
              },
              "native_event_id": 40,
              "native_source": "0x34bf6",
              "native_text_index": 1
            }
          },
          "type": "dialogue"
        }
      ],
      "event_id": "legacy/event/7ba5d82bdc2a/events/1",
      "extensions": {
        "legacy": {
          "id": "reinforce_ch17_e40_t4",
          "once": true
        }
      },
      "trigger": "on_turn_end",
      "when": {
        "turn": 4
      }
    }
  ],
  "extensions": {
    "legacy": {
      "chapter": 17,
      "deploy_cells": [
        [
          23,
          36
        ],
        [
          24,
          36
        ],
        [
          23,
          37
        ],
        [
          24,
          37
        ],
        [
          22,
          6
        ],
        [
          23,
          6
        ],
        [
          23,
          7
        ],
        [
          22,
          7
        ],
        [
          6,
          23
        ],
        [
          7,
          23
        ],
        [
          7,
          24
        ],
        [
          6,
          24
        ],
        [
          39,
          23
        ],
        [
          39,
          22
        ],
        [
          38,
          22
        ],
        [
          38,
          23
        ],
        [
          22,
          35
        ]
      ],
      "initial_groups": [
        0
      ],
      "initial_groups_if_party_absent": [
        {
          "char_id": 18,
          "group": 1
        }
      ],
      "map": 16,
      "name": "血與冰之刃",
      "native_death_programs": {
        "2:41": [
          {
            "native_dialogue_ref": {
              "control": "FFED",
              "glyph_ids": [
                [
                  [
                    557,
                    629,
                    411,
                    344,
                    584,
                    629,
                    411,
                    344,
                    462,
                    608,
                    559,
                    1357,
                    367
                  ],
                  [
                    181,
                    98,
                    169,
                    669,
                    654,
                    428,
                    373,
                    784,
                    568,
                    180,
                    584,
                    584
                  ],
                  [
                    181,
                    881,
                    98,
                    370,
                    850,
                    850,
                    568,
                    584,
                    584,
                    560
                  ]
                ]
              ],
              "line": 9,
              "operand": 16,
              "pages": [
                [
                  "『為什麼．為什麼這些下賤的",
                  "　人類居然能打倒我？．．",
                  "　主人，救救我．．』"
                ]
              ],
              "scene_index": 1,
              "script": "assets/story/ch17.json",
              "source_dat": "FDTXT_017",
              "string_index": 3,
              "utterance": 0
            },
            "native_event_id": 41,
            "native_source": "0x35009",
            "native_text_index": 3,
            "type": "dialogue"
          },
          {
            "native_death_op": {
              "kind": 0,
              "op": "reward",
              "value": 213
            },
            "native_event_id": 41,
            "native_source": "0x34fff",
            "type": "native_death_op"
          },
          {
            "native_dialogue_ref": {
              "control": "FFEE",
              "glyph_ids": [
                [
                  [
                    557,
                    701,
                    342,
                    462,
                    65,
                    346,
                    343,
                    584,
                    1100,
                    273,
                    132,
                    256,
                    1102
                  ],
                  [
                    181,
                    321,
                    322,
                    180,
                    508,
                    579,
                    343,
                    395,
                    273,
                    103,
                    157,
                    367
                  ],
                  [
                    181,
                    390,
                    391,
                    584,
                    584,
                    560
                  ]
                ]
              ],
              "line": 0,
              "operand": 17,
              "pages": [
                [
                  "『咦！這可不是．「冰之眼」",
                  "　寶石？原來是在冰魔神的",
                  "　身上．．』"
                ]
              ],
              "scene_index": 2,
              "script": "assets/story/ch17.json",
              "source_dat": "FDTXT_017",
              "string_index": 4,
              "utterance": 0
            },
            "native_event_id": 41,
            "native_source": "0x35041",
            "native_text_index": 4,
            "type": "dialogue"
          },
          {
            "native_dialogue_ref": {
              "control": "FFEE",
              "line": 1,
              "operand": 18,
              "pages": [
                [
                  "『你也知道「魔眼寶石」的事",
                  "　？』"
                ]
              ],
              "scene_index": 2,
              "script": "assets/story/ch17.json",
              "source_dat": "FDTXT_017",
              "string_index": 4,
              "utterance": 1
            },
            "native_event_id": 41,
            "native_source": "0x35041",
            "native_text_index": 4,
            "type": "dialogue"
          },
          {
            "native_dialogue_ref": {
              "control": "FFEE",
              "glyph_ids": [
                [
                  [
                    557,
                    585,
                    370,
                    906,
                    388,
                    568,
                    529,